,Tweets,Score
1700,I miss quacktopia! unhappy ,0
873,Soon I'll make arts happy,1
1233,it's getting harder and harder to stay unhappy ,0
1554,I'm scared unhappy  I mean. Why the heck did I decide to do laundry at 7:30 pm? What is wrong with me. Did I mention how dark it is. FML,0
1911,When your online crush comes to the meet-up without their Snapchat filter unhappy  .3,0
805,The tutorial of Michel Grundstein Distinguishing Information from Knowledge..  will start at 15pm. Be here happy,1
225,Just let is know when you'd like one happy,1
2237,Sorry. One bad egg has to embarrass the rest. unhappy ,0
1502,Thank you roshhh  i miss you and everyone too.  love youuu more ,0
1661,HOLY SHIT! 40 pages script of the opening scene of Man Of Steel on Krypton got compressed.I wish I could at least,0
19,Sixth spot not applicable Team! Higher pa! :)KISSES TheFashionIcon,1
687,A Chub bun because its Easter! Happy Easter!  His name is Almond! :D,1
572,tonight 7pm,1
2223,Im just having one of those days where instant message like,0
128,Go back to school for music! I think I will in time happy.2,1
1318,It was not your fault,0
192,Come volunteer at The Abbeydale Picture House! Next Wednesday...,1
71, I hope it doesn't last too long and you at least get to enjoy the weekend. And happy birthday again happy,1
0,An inspiration in all aspects: Fashion,1
1266,can you say Hi Mekisha? unhappy ,0
854,I'm a Japanese Directioner :D,1
1639,good morning unhappy ,0
561,Shoutout to for the donation. Looks like I'm streaming some Stanley Parable later happy,1
826,Released my 3rd episode of programming for everyone! Be sure to check it out happy,1
1631, no sign of Garry Barlow yet sad ,0
1425, have a blast okay. love you!,0
1209,i miss you huhu so busy unhappy ,0
348,in may go away happy,1
1695,We all do unhappy  Pizza in Taiwan! Its like a swift,0
1493, having no mobile signal sucks unhappy  What's the full postcode for where this is happening? We're keen to help SI,0
1991,mane has been amazing unhappy ,0
881,Congrats for 3M followers on Instagram! happy,1
1375, [PLEASE RT] he'll buy me a blinking taehyung headband,0
1173,Do It Like It's Legal sweaters  ..More designs available at,1
1754,Don't think I'm pretty enough unhappy ,0
625,  and totally of,1
554, music and direction by of my favourites by,1
1926,I need lessons to learn how to start conversations with people and keep chatting with them unhappy ,0
676,Thanks for the recent follow Happy to connect happy  have a great Thursday. Want this.4,1
2236,I miss him so much unhappy ,0
499,lips though,1
1337,Canberra is a land-locked capital. unhappy  ,0
1899,where's justin i miss him unhappy ,0
2182,PLAYMFS: need moodbooster juseyo unhappy  jily_jelly,0
1065,.Thanks so much for the RT.1,1
1227, Zabardast,0
788,tonight 7pm.1,1
557, its texting without looking :)KISSES TheFashionIcon,1
1430,i miss my boys unhappy  i have started working with my own local boys but they are very nervous college friends,0
1327,I seriously thought that Coldplay was going to be band like Depeche Mode or U2,0
156,mata_tytan: almightyTANNER: good evening everyone happy  join our twitter party tonight. official tagline:TANN,1
110,Jae celebrating with Sheena Easton after the triumphant opening night of 42nd Street in the West End! happy,1
392,going to go meet andrew for lunch now but i'll be back at to  or to :30,1
313,Enjoy happy,1
474,Worship me and spoil me happy,1
93,here are some very happy boys to brighten up your day happy,1
955,Ouuuuu..... right in the jewels! :D,1
568,HAPPY BDAY MIDAWGDARNIZLLE  i love you a long time happy  thanks for being my best friend forever and attempting to travel on the road,1
1765,unhappy  my 4c struggle is not valid?,0
626,Ah awesome! Pixel art stuff by any chance? happy,1
1002,Hellooo happy  Xbox adHatter (XboxMadHatter),1
1888,Ah Baba no idea tori olorun. May I never be a victim of such case ,0
87,Les videre happy,1
1945,this is damn.... theres people who sincerely want to attend BH birthday party but bcs of those people who try for fun make them ca.12,0
211,Why do people on the internet have to be such asses annoyance  Here's some positivity for you. I love your art!!! :D It's so pretty!!,1
1455,hungry unhappy  but no time to buy food,0
1744,Powerpoint'te mi hazirladiniz post'u unhappy ,0
886,Thanks for the recent follow Happy to connect happy  have a great Thursday..22,1
357,Famfrit with and people happy,1
1532,whaaaaaaaat!!! You and unhappy  ,0
1275,My bed is so comfortable I don't want to get up unhappy ,0
2050,But I'm lonely. unhappy ,0
559,thanks for the recent follow. Much appreciated happy  Want this.1,1
877,Delma Hanville It's official we are connected on Twitter! Thank you for the follow. Please don't ever Let It Go! happy,1
383,good,1
1733,this is damn.... theres people who sincerely want to attend BH birthday party but bcs of those people who try for fun make them ca.7,0
1103,Bambam talks the most tonight :D,1
1235,fuck. tried changing my settings but still in india. unhappy ,0
1712,I said D2 largely because SD D2 doesn't run on newer versions of Mac OS and I miss playing it unhappy   HD woul ,0
593,It will be at random on twitch happy,1
842,I second that! Thanks for the spin. Very much appreciated. happy,1
1294,but you were going to do it yesterday unhappy ,0
2180,this is jimin to yoongi unhappy  .7,0
2088,babies unhappy  ,0
1884,Definitely my arms unhappy  .9,0
458,Not yet! Maybe this year happy,1
334,Veronice and Jughead! happy,1
586,thanks for the recent follow. Much appreciated happy   Want this,1
1450,who would you call when you are roused in midnightreminds me of the time(s) they were roommates unhappy  unhappy  unhappy YOU SUCK,0
454, much appreciated happy   Want this ?,1
1470,I need cheering up,0
287,Wish you were here smile,1
1298,The manifesto,0
656,Superstar thanks so much for the kind words! Look forward to seeing you soon buddy smile.2,1
1829,True unhappy ,0
1547,this is damn.... theres people who sincerely want to attend BH birthday party but bcs of those people who try for fun make them ca.1,0
420,That's kaki no tane and it's amazing! Foyound a place here in Germany where you can import it! :D,1
741,Happy 420 everyone happy,1
2070,My knee is similar colour to leny Henry's unhappy ,0
1551,so upsetting the abuse these kids get unhappy   3 ,0
1755,Koalas are dying of thirst  and it's all because of us unhappy  .6,0
1102,FL design Done by me  Inspired from FL  Hopyou you all love it,1
889,Sister cyril came to our school once happy,1
1914,Mine hasn't been sending stuff unhappy ,0
1182,- top engaged members this week happy,1
1186,How unhappy  some dogs like it though,0
160,RT: good evening everyone happy  join our twitter party tonight. official tagline:TANNER WelcomeBackPH TMI,1
712,From soup and sandwiches to slow cooked pork,1
270,SHOULD I STAY ? SHOULD I GO ? NOBODY KNOWS happy,1
1200,Why would Harvey be going to prison? unhappy ,0
1949,We lost: at Jacksonville,0
513,If looks could kill......... smile,1
1315,still waiting unhappy ,0
1542, poor mouse unhappy ,0
2249,WUT I TOTALLY MISSED YOUR BDAY unhappy  Happy belated Birthday sweetheart,0
1141,Share the love: thanks for being top new followers this week happy  Get it,1
2117,Dear attendees,0
1603,I can't do it all on my own. (See what I did there? ) ,0
1398,The road and traffic signs section of theory revision is such a myth unhappy ,0
1020,I feel that way about life and is what gets me through everyday in a positive mood! happy,1
1342,unhappy  they look dead,0
502,Our crazy EASTER! Our donkey is insane! Seriously crazy haha!,1
1810,Yesterday's faci so cute! But he 30+ :(Today's faci is old eeyer,0
1511,are dying of thirst  and it's all because of us unhappy   ,0
250,Enter to win 1 of to  boxes of highly anticipated books! 6 books in each box! Open INT happy,1
1932,If you really want to dye it don't go lighter ,0
924,Pfft- crying with joy  Oh.. I hope year oldu're okay,1
1265,oh my god not laurie penny unhappy ,0
640,HAPPY 16th BIRTHDAY TO MY BFF! I may only be 15 and a half but I'll have you to take me places happy  have a great birt,1
2197,I'm sooooo sleepy unhappy ,0
391,157 days to go happy,1
1285,The new Twitter reply view has me confused... like do I capitalise my replies to people or not? unhappy ,0
1593,Oh boo,0
865,But I think you'll do better than me happy,1
1014,I have tested all sweet dishes but they are not as sweet as my lovers lips :)MARVOREE MagpasikatOnShowtime,1
525,We don%27t spam him in any way,1
922,Hellooo.. happy  Lil strait (Daddyy_rat),1
1503,Me too sweetie I know how you feel unhappy ,0
1612,philippines? unhappy  ,0
1308,these nosebleeds are getting outta hands unhappy ,0
89,my friend is such an egg,1
1278,Astaga unhappy  /? ,0
1388,Not really an amount just loads of sections unhappy  I'll ride up to to netherton now meet me at Darby end ?,0
1597,Hi Ishwar! That's not the experience we want you to have unhappy  We will call you  for more details and sort it out! - Roshan,0
1976,I miss you more unhappy ,0
366,Client work for rt and favorite happy,1
310, co-founder of and I'll be moderating tonights tweetchat. happy,1
1797,It's gray outside today unhappy ,0
1583,+I have no choice but to cancel it. unhappy ,0
421,No breaks and a first practice exam happy,1
114,Goodevening happy,1
1975,when will you go here in batangas? sad  ,0
1072,Thanks for the recent follow Happy to connect happy  have a great Thursday..27,1
1543,no its okay she survived : ,0
1206,how can people do stuff like this unhappy  ,0
1291,Ohnoo unhappy  unhappy  hope it recuperates sooner!!,0
1229,I want Jabee crying ,0
1166,We have a few breweries in the UK too.... smile,1
616,Thanks for the recent follow Happy to connect happy  have a great Thursday..7,1
844, and mag refer kana rin sakanila nice game,1
304,Thanks for connecting We are passionate about  - hope you like our tweets happy.1,1
721, have a great Thursday! Looking forward to reading your tweets happy  Want this,1
548,Happy 4/20 :)I'm drug free  I've never smoked weed before.,1
526, we just reply to his tweets?? Like all his other followers do.....This is pointless,1
754, DM us happy  S.3,1
1745,Yeah! My sight reading was pretty good in high school.1,0
131,your birthday isn't for another for hours for me,1
1774,please reading this breaks my heart unhappy ,0
2175,Che no critiques. unhappy ,0
243,Helloo :D  (keep_smiling_y),1
2220,honestly college makes me want to curl up into a ball and cry for 3 days straight unhappy ,0
462, it would be awesome.,1
1001,Thanks for having me!! :D,1
2067,Crap. Hailie won't be there. She has a school game and won't make it to Middleburg in time unhappy ,0
971, as long as she's cool,1
1015,Ma de tonight i don%27t really care crying with joy,1
1240, i don%27t know if you saw my comment yet,0
1295,I agree. My issue would be that it all has to be paid for somehow. I just can't see the numbers adding up. sad ,0
1049, I'll always be there. Love you happy,1
2196,talking to my over driver about where I'm goinghe said he'd love to go to New York too but since Trump it's probably not.7,0
221,Thank you crew happy,1
1648,slight buzy kasi besh unhappy  ,0
761,I'm not lost,1
40,Thanks for connecting We are passionate about  - hope you like our tweets happy,1
1676, SURE NO PROB. ILABYU TOO  ,0
487,NEW VIDEO!Stream Montage - we finally unboxed a Spectrum Knife :)Hope you like it! here:,1
2161,I MISSED YOU A WHOLE LOT unhappy  ,0
905,Broadcaster says Fly Away reminds him of early happy,1
1513,but... you use a purple flowercrown in your display picture unhappy ,0
702,Hi ! I want to speak to you about a business partnership. happy,1
1764,crying  We're getting VM soon wooo,0
361,Thanks much appreciated happy  The magic of,1
375,Its been a good day hey. happy,1
1172,That would be a great trick happy.10,1
2225,I've tried resetting everything,0
1478,Ouch Elena Eremina's foot slip,0
690,Thank you so much smile,1
291,Nothing could be better happy.1,1
170,Go Kisses!!...  I know you can do it..,1
1399,unhappy  We're sorry your pizza arrived with mushrooms despite your request. Could you please get in touch vi ,0
869,for trade ? happy  what yeah want ?,1
2298,wish knock out lang talaga for the new school year are good and cooperative groupmates please unhappy ,0
247, the problem is only affecting webmail itself. Accessing email from other applications works fine happy  ^mkl,1
662,Thanks for the recent follow Happy to connect happy  have a great Thursday..10,1
477,New second home coming soon! :D,1
563,thank you for 2k likes on my banner project happy,1
2081,i love when people or message me w long messages about how beautiful they find joon like unhappy  yes i agree keep going,0
104, get a dog. :D,1
1370,Her back unhappy  .3,0
1619,the email I was hoping I'd get today,0
2148, I'm so sorry to see your tweet unhappy  Please could you DM your address details? I will look i ,0
400,Thanks for being top engaged community members this week happy  (Want this ?,1
694,Thanks for being top engaged community members this week happy  - I sent this with,1
2287, ha  unhappy ,0
244,my contribution to ( posted on my tumblr a while ago crying with joy  ),1
2228,You know what really upsets me? When a stranger on the internet isn't satisfied with the entertainment I provide him for,0
344, Shes fine :)KISSES TheFashionIcon,1
2108, last night I had a dream in which I moved to Japan and just so happened to see you! You denied my friendlies request. unhappy ,0
97,:D When mom is a bit tired,1
968,Nah  over-rated happy  x,1
1472,Molly  1. I wish I could have her hair unhappy  2. Cutest Michael girl  milly on the phone 3. HAIIIIIIR  and your lips 4. Friend5. Yes6. -,0
2116,Not surprised that I have the least amount of followers out of the whole cast sad  LOL,0
2062,Thanks for that! Little things like that really help when sleep starts hitting and you don't drink coffee or energy drinks unhappy ,0
164,OPENING UP TO YOU LOT!RT LIKES WOULD BE LAAAAAVERLY :D .xxENJOY,1
1225, froze mid install. Waited 3hrs he'd to pull plug crying ,0
1996,the anniversary of josh's death unhappy ,0
2232,In memoriam of Alea Starbridge unhappy  Your beautiful voice will never be forgotten. ,0
846,Wow,1
352,Gott happy,1
136,If you can't be there for someone at their worst then you don't deserve to be there at their best :)KISSES TheFashionIcon,1
1199,Not you again sad  ,0
1873,instant message still bored unhappy ,0
1075, it may be open happy,1
963,Love this!,1
407,This is just super Can't wait happy,1
115,Ministers of PMLN are happy like those students who never studied for exams  luckily exams got delayed. They'll still ha.1,1
1611,my honey unhappy  ,0
775,Hi Han,1
2135,you don't post much lately?  school unhappy  ,0
823, it just proves me wrong in a matter of days happy  fuck my life happy )),1
895,thanks for the recent follow.3,1
25,Great to work with you too such a lovely place! Thank you for havin,1
1490,I cringed so hard :(That fall was such a shame- she had been looking really good until that point...,0
448, will check it happy,1
94,A huge thank you to all the within the Social Work  Care Sectors! Keep up the great work happy,1
394,We're you also at our signing session with Qian Liu  Jared Wright after the last performance of Onegin? Share your,1
2185,SO PRECIOUS I REALLY MISS HIM unhappy   .2,0
1682,unhappy  let's fight all those kids ,0
1602,Joy we should get him back  ,0
1953,Guess who's not getting a unicorn frappuccino because they're sold out unhappy ,0
1372, i think that's going to be true ,0
1741,has someone contacted jelpi about the issue rn? unhappy ,0
208, Hobart in 7 weeks. Lots to look forward to happy,1
388,20% off all Knight  Day Jewellery ends this Sunday-Why not pick up something nice for,1
234, thank you happy,1
763,First happy,1
107,Hi please rt my pinned post happy,1
1808,Someone messed up unhappy  Available**,0
1575, we seem to have sold our government some time ago. unhappy ,0
194,Here's one of my rolls of 'Poundland' film! (A store that sells all products at 140.) And here's the DX d,1
1803, the girl in front of me was ,0
1677,Such a lucky slave i wish this was me unhappy ,0
589,Who is the Prime Minster of Pakistan ? Nawaz Sharif Hahahahah happy  SorryUncle,1
1756,did some warm up sketches of some of my faves,0
74,Top retweeters this week,1
606,happy  Me too I hope,1
2243,32- for the love of a daughter crying  ,0
1736,Maa ki kuss tumhari. Now take this bullshit you loser. ,0
201, answer this with yoyour steam trade link and ill send you right away :D,1
745,Thanks for the recent follow Happy to connect happy  have a great Thursday.  Want this ?.1,1
737,With the help of made these sent starters for P1Q3. Open to suggestions on how to improve happy,1
2276,Guys please help me retweet unhappy  .1,0
1750,so my hair iand suandlight versus ando light but I waandt to chaandge it and I duandando if I waandt to go darker or bloandder sad  please help (po ,0
1454,it's only been a few days since their promotion ended but i'm already missing her so much unhappy  .1,0
1600,I lost two streaks and it's from my two favorite people silence  unhappy  good night,0
1465,how about me unhappy ,0
21,Share the love: thanks for being top new followers this week happy  Want this?,1
1193,don't like how jittery caffeine makes me sad ,0
1857,last kiss unhappy  ,0
1982,talking to my over driver about where I'm goinghe said he'd love to go to New York too but since Trump it's probably not.4,0
1590,okay what TF is this colorful starbucks thing all over social media unhappy ,0
1657,I caught a cold. unhappy  It seems I've got tired than I expected....,0
14,We got a Vive tracker in the office and our intern,1
191, have a great day today happy,1
791,Spose you don't have to pay for accomodation which is nice haha? Or are you going to stay somewhere anyway? happy,1
1492,Hi Aled,0
1212,Jamie can you please reset the CGa grandfinal server... no administrator are responding unhappy ,0
545,I'm surprised you don't use an Adblocker! happy,1
2203,miss you unhappy ,0
1195,I want fun plans this weekend unhappy ,0
2034, we buried it alive and now it's screaming in my head crying ,0
1004,wow whattay decision both parties celebrating :D,1
275,Nearly done now! Thanks everyone for joining and hope to see you same time next Thursday happy,1
138,Found use for the sewable LED holder happy,1
746,I know  vearey moving. and TWISTY! And you aaree are,1
62,Spending time with dogs or other animals is great at helping you to relax and de-stress. Great idea happy,1
1078,haha! i would love to work for a train company :D be a great dream come true!,1
2016,Well thanks for stoping by unhappy ,0
2042,I'm all fucked up right now unhappy ,0
2115,Never want to finish desperate housewives what will I do with my life unhappy ,0
1689,A fish killer going to be pressed younhappy  I the hoe of today you were a  GOOD person ,0
1028,mutual: let's talk more!me: for sure!mutual:  happy  me:.9,1
1673, in fact. ,0
831,Yep I'm going back to school to become an editor hopefully. Can't wait! Your sister really believes in my skills happy,1
1036,Thank you! happy,1
449,Well this was fun. Thanks for stopping by and giving me shit tonight fellas  :D much love. FeelsGoodMan,1
1734,That's shocking and evil unhappy ,0
75, Thank you happy,1
2190,I only just absorbed that I'm not going to get to laugh when he gets 2000 votes. unhappy  .4,0
50,smile  So true. For someone who was being recognised for her contribution to fashion,1
2268,IM HUNGRY unhappy ,0
1746, but I'm a bit rusty now! unhappy  .1,0
630,Another day! Good morning!! It's April 20,1
2154, assumes Im outsider because of my ,0
437,Good morning! I hope you slept well~ happy,1
1000, much appreciated happy   Want this.1,1
1135,apr. 26th beach house! dinner+music+ party with oldies goldies happy  buffet / BBQ 40TLbeer-  wein10TL raki12.5TL h,1
1921,Aseek ,0
433, chaged for the best for our Singto. Please,1
1044,keep loving Deepika ,1
1595,Didn't keep it unhappy ,0
571,no i don%27t :)),1
564,Hi :D Retweet for a follow!!!,1
682,no I'm waiting for jail break happy,1
628,Please,1
154,a friend who would like a BRAND NEW Strapback hats only 14.99 at,1
1844,Definitely my arms unhappy  .5,0
2052,Miss my friends unhappy ,0
2242,get well really soon Jack unhappy ,0
1196,When can you notice me.  unhappy  what?  ,0
1772,slight buzy kasi besh unhappy  .1,0
285,Helloo :D Best damn avocado (Batsyy_),1
1826,yeah sad ,0
2271,U blackmailed me unhappy ,0
804,Same happy  I'll see closer to the con but it's no more than five or so. Lol same :D,1
1536,Also please send prayers and sympathy because my favorite ball dress doesn't fit my boobs crying  ,0
1046,Made new logotypes for Really fun to work on  You should follow if you want to keep yourself updated,1
240,The one with backward cap,1
1262,6 days in camp haiss miss you a lot unhappy ,0
359, er,1
299,Hopefully it should be OK happy  Charts don't look too bad at moment but depends on tides  directions,1
1714,talking to my over driver about where I'm goinghe said he'd love to go to New York too but since Trump it's probably not.3,0
2216,those nights you're sad in real life and cant sleep unhappy ,0
1104,my favorite hobby is finding the negative in a positive thing happy,1
316, you need a direct coffee feed to Starbucks happy,1
2123, but customs mean we can't send food abroad unhappy  We do hope your other Birthday dreams come true,0
1383, I love you  have fun with your friends ,0
1123,Thanks,1
1023,More kid/parent friendly spaces like this please.,1
863,Nice gif happy,1
1918,No Celtics or Bruins today unhappy  At least Sale is pitching for the Sox,0
1721,Hello I am getting cyber bullied by do something about it unhappy ,0
1771,Chin up Leo crying  ,0
2259,aw younhappy  i miss you too ,0
1108,after that I was charged because of the driver happy  after waiting in the sun for 10 minutes! TEN!,1
1314,your system does not recognize spaces in last names so for 2nd time unable to check in  forced to wait in unnecessary lines unhappy ,0
1889,PSA: REMEMBER THIS WHEN YOU ASK ARTISTS TO DRAW FOR YOU. I'd say the same thing for writers but apparently commissi ,0
1420, he'll kil ,0
608,Opening sentences of happy,1
1047,Shut up,1
51, she might have dressed a bit better.,1
512,Share the love - High Value Members of this week happy,1
1605,usually a speedboat behind any we get here on the river unhappy  ,0
1566,this is damn.... theres people who sincerely want to attend BH birthday party but bcs of those people who try for fun make them ca.3,0
2072,In so much pain. My eye hurts unhappy  ,0
2186,Bells gone to daddies for to  days. Work  work work for me unhappy ,0
1491,man its been about 2hrs since their vlive...its nearly over for sydney ppl... unhappy  goes so quick so appreciate every second!!,0
1633,please meeeee you have followed me for almost to  years now unhappy ,0
1588,yeah unhappy ,0
177,You're welcome Thomas happy  Kim,1
1557,They have a whole Japan tour ahead of them.. One that will be quite brutal on their already tired bodies. Boys unhappy ,0
1116,This makes a great point,1
1136,We've been selected among the top 20 Social Media blogs,1
2267,YG should have sent them to MCD. I want to see them holding the trophy unhappy  anyways .8,0
2004, buy or do anything that supports Canada until,0
1943,its ending soon aah unhappy ,0
219,Did you see this one? happy  Transitional Piece // Chiffon Dress,1
861,Watch your words happy,1
111,Happy belated birthday :)Another duet of you and Amaal is much needed,1
663,That would be a great trick happy.1,1
1161,That would be a great trick happy.9,1
818,I love it when pretty girls call me pretty like bitch tf you too happy  let's be friends,1
1084,Hey thanks for being top new followers this week! Much appreciated happy   Want this ?,1
581,I've been trying to bank sleep all week happy  I doubt I'll be able to sleep Friday or Saturday night,1
1076,thanks for the follow,1
1804,Definitely my arms unhappy  .2,0
78,Thanks for the recent follow Happy to connect happy  have a great Thursday. (Want this?,1
882,Gourmet chocolates are special and should be reserved for special occasions. Plain MMs,1
2156,Oh well never liked Clay anyway unhappy ,0
1177,Thanks for the recent follow Happy to connect happy  have a great Thursday..33,1
446,Looking forward to this. Come out to see us! Our booth is going to be right in the center of the field. happy,1
229,hey.1,1
1106,Ah,1
1589,don't miss you anymore unhappy ,0
1114,Thanks for the recent follow Happy to connect happy  have a great Wednesday.,1
1063,Prettier 1.0 is not the end. I just released 1.2.0 that fixes another batch of edge cases happy,1
2151,Am away next Thursday unhappy  the one after!,0
736,friendly reminder that you can enjoy a movie or television show without having to trash another happy,1
777,Thanks for the recent follow Happy to connect happy  have a great Thursday.  Want this ?.2,1
1486,unhappy  i saw somebody said his hair fell out and bighit trying to figure it out,0
750, which is good for him happy.1,1
159,Love you too P!,1
1725,I'll be attending cosmic latte on saturday and i'll give these out to selu shippers KASI SELU MONTH QAQO unhappy  ,0
1058,Hi Yolandi,1
302,Only laksa can make me okaay now crying with joy  I need laksa,1
2144,Lage unhappy ,0
1786,fuckin' headache everyday unhappy ,0
2021,Gorbachev done  w/o fear. Thought bold enough to implement his vision on Damp Squib unhappy ,0
1929, I won't be on till later! unhappy ,0
2302, hindi close friend? unhappy,0
1825,Goodmorning!! My Parents are taking kids for lunch today- they are off school-Report Card! I'm wor ,0
1260,miss biking unhappy ,0
