,Tweets,Score
148,Ok. Just please read the replies on this....,1
2060,Why am I better at pen then pencil?dafaqcomonI just want to be a good drawer unhappy ,0
2179,Miss the rain unhappy ,0
463,No stress Mariana,1
2289,That was a FUN night! Sorry I missed last night unhappy  We really need to sync our calendars with and ,0
476,Superstar thanks so much for the kind words! Look forward to seeing you soon buddy smile,1
1374,Yesterday felt like friday unhappy ,0
1120,True! U can waste a day in social media and reading websites. On the other hand,1
534,that's insane! good luck for that! I took it off yesterday afternoon. :D,1
2239,I miss Temperance Brennan and Seeley Booth so much unhappy .1,0
422,made dinner for two tonight happy,1
1871,Guys please help I tried to smoke some lettuce earlier but now my salad is ruined unhappy ,0
1494,That sucks unhappy ,0
418,Congratulations,1
133, i love you i guess happy,1
759, or SHIT for short :)*Thanks to my friend maddy over at,1
706,Follow him happy,1
2194,Oh no Andy unhappy ,0
1228, Another ATBB on it's way ! I wish Srk Sir starts signing good movies unhappy  ,0
2210,I work so much better there unhappy ,0
2300,Same unhappy .1,0
146, looking forward to you visiting! You've picked a great day too,1
603, Order what ever you want to eat through our website.May you all have a great day happy.1,1
1152, months and years of bonding and happiness  family MCLISSE StarMu,1
2155,oh shiiiiid noooooor unhappy  ,0
617,Thanks for the recent follow Happy to connect happy  have a great Thursday..8,1
859,In class and I'm really bored so why not happy  Rt for one!! Mutuals  non mutuals Pls don't let me flop ;-;,1
455,How people write a joke on religion online.*Joke**Just joking guys,1
768,Many thanks,1
762,Thanks for the retweets this week. Much appreciated happy   Want this? It's FREE!,1
1126, that's Europe,1
1165,Retweet if you are with us? Kaway kaway family :)MCLISSE StarMusicIfWeFallinLove,1
197,Love them! Can I get some? smile,1
1384,YG should have sent them to MCD. I want to see them holding the trophy unhappy  anyways .5,0
637,where ? happy,1
490,ready for 420 happy,1
2058,No one is offering this poor old lady a seat unhappy ,0
2245,I'm so tired of pretending I'm not falling for you unhappy ,0
326,little fans. - happy,1
459,Hey thanks for being my top new followers this week! Much appreciated happy   Want this ?,1
1310,Dude I just want more sleep unhappy ,0
410,Thanks for the follow happy  If we can help your business in anyway please get in touch,1
2046,Koalas are dying of thirst  and it's all because of us unhappy  .8,0
1693,I face swapped a cat with a dog and it's really upsetting unhappy  .3,0
1025,Va astept la acest eveniment! :)Next events:,1
915,Gamer Follow Train!Follow MeRetweet thisFollow all who retweetedGain active followers happy  450,1
2074,It's hard to imagine anyone but Robin unhappy  but still exciting nonetheless,0
1402,Wish I could stay in bed all day and listen to the rain sad ,0
1498,GOD NOT THE KOALAS ,0
1751,Hi Ashish! We tried to call your number but got no response unhappy  Please share another suitable time and an alternate.. cont1,0
569,Fri or Thu? I'm going to the Friday showing :D,1
594,Good morning every one,1
685, have a great Thursday! Looking forward to reading your tweets happy  (Want this? It's FREE!,1
1222, it looks like iOS 11 is due to kill it unhappy  ,0
1951, 24-20 unhappy ,0
556,If school has taught us anything,1
543,Don't mention it! :D,1
1005,Free market is tops!!! Real human rights sound great to me,1
2086,jungkook looks like he gives the biggest and warmest hugs unhappy  .1,0
1674,I'm so glad I don't care what people think anymore but I wish I still looked my best everyday like I used too sad  I just pick,0
2079,I feel so awful today unhappy  I don't want to go to my internship,0
2281, but how about yours? unhappy ,0
2279,:'(( well,0
2038,NOOOO in here is 6.45 ;_; I have classes at that time unhappy ,0
1254,Hey Tony,0
1085,Thanks for being High Value Member  this week,1
591,Agreed! I feel like I've skipped too many css/design fundamentals. I'm spending the next couple of,1
1170,Be happy,1
117,=Thumbnail UHC= This is my best render ever :Dand Favs are appreciated brosOpinios ?,1
2049,can I only pick one unhappy  ,0
2172,unhappy  But if there'll be 1 Silver-that'd be him!,0
1895,don't rt to save a guy's life ,0
402,Thankfully I didn't have to chop it myself,1
1920,Nooo your hair color is pretty .1,0
70,Well,1
451,see the next tweet! I did about 5 different things while keeping very calm,1
1453, I just hope everything goes right from now on unhappy ,0
1952,i hope this little beaand is andot overworkiandg himself and gettiandg at least some rest unhappy  .2,0
17,Take a look at favourites.io You can do this and more happy,1
2284,don%27t be surprised if you see me cry today,0
910,Thanks for the recent follow Happy to connect happy  have a great Thursday..23,1
1770,this is jimin to yoongi unhappy  ,0
2059,lexxxxxy unhappy  youre too nice to me instant message really not eek  ,0
1474,I'm a building a LLVM backend so,0
1432,ugh i miss my baby crying ,0
1277, I sincerely hope not too many priceless antiques were destroyed. Reg ,0
1373, he can't leave us unhappy ,0
369, huh? happy,1
1709,Finals are next week unhappy  wish me luck x,0
169,We're ready for our next fire lighting session at - we have a few keen early birds here already smile,1
664,i have a goal today happy  i%27m going to accomplish it,1
2122,We'd love to,0
972, I'll like her happy,1
649,Thanks for the recent follow Happy to connect happy  have a great Thursday. Want this ?,1
180, so I'm super impressed he's got his musical mojo back! Thank you so much happy,1
677,National BitBucket Unfriending Day to save $2 smile,1
65,Love your tweetability! We'd like to reach out to with an opportunity! Could you hit us with your email happy,1
1269,Visual Studio Installation - 89% .. BSOD comes suddenly unhappy ,0
1272,crying  muh feels,0
236,I suppose they are waiting for you happy,1
1956,unhappy  oh man..,0
215,Happy birthday Megan happy,1
1501,I could write paragraphs about it xDShame its theoretically impossible in real life unhappy ,0
18,Go back to school for music! I think I will in time happy,1
614, just type and ask anything you like happy  aa jao for,1
135,The offer still going happy,1
1113, random winner :D Retweet AND LIKE to be able to win happy,1
1594, mine isn't in my inbox unhappy ,0
2083,Used up a month's worth at Laugharne Weekend sad  (no wi-fi in small Carmarthenshire towns,0
1827,Streaming later in the day (night stream) since i have to go and take care of the internet contract,0
708,tats! I have question happy,1
405,Ready Now! One 9 week old chocolate female puppy from Harlowe x Sterling! happy  This girl is a sweetheart and has a...,1
1930,Lets hope a VIP does this good deed. I want to watch this too . They shouldn't have done thi ,0
936,We've 80 so far in our collection of 150+! happy  New gin menu coming soon as well!,1
1531,Still not possible! unhappy ,0
1972,jyoustinbieber can you please follow me on daianeryoufato i've been trying for too long unhappy  i love you so much baby! xx (April 20,0
1541,Hope he's ok,0
933,Veronice and Jughead! happy.1,1
531,thanks for the recent follow. Much appreciated happy  Get it,1
1672,The biblical lectures are coming. More notification soon. Tomorrow,0
202,for the recent follow. Much appreciated happy  Want this?,1
1070,Made my day! Great story happy,1
1092,In case you missed it,1
2137,Koalas are dying of thirst  and it's all because of us unhappy  .10,0
527,Unnamed: 527,1
132, but happy birthday hoe! have a good day,1
1561,clay and hannah   - they were so in love they deserved to be endgame unhappy  ,0
1749,what a great thing to be sad about unhappy ,0
1687,i miss hoseok unhappy  ,0
2028,That is super scary unhappy ,0
1903,I'm so tired unhappy ,0
733,Client work for rt and favorite happy.1,1
1814,I WAITED FOR U unhappy ,0
235,What a day! What better way to spend this sunny day than drinks by the shore happy,1
2193,I wish I could say the gangs all here but Daniel's not in this picture. unhappy   Rantoul Twp High ,0
2008,Don't ask. Two special issues lined up. unhappy ,0
1973, 2017 at 08:45AM),0
2078,Rl? Serius? ,0
618,Physics will have 80 formulas to memorize Ha.ha.ha happy,1
415,This never happened with our happy,1
1271,So sad unhappy  ,0
1586,R.I.P cellphone unhappy ,0
341,Nothing could be better happy.3,1
1320,i tried fixing my choristers dress hem that came undone by taping it with fabric tape but i put it on wrong and its even more ruined unhappy ,0
2188,Well that's my weekend viewing plans changed! unhappy ,0
1868,ill be at work just a second come on unhappy ,0
1390,Got a msg! Oops not you unhappy ,0
901,I really must go see Power Rangers again. smile,1
570,I was thinking about how I don't want to go to school and I'm suddenkyfeeling good happy,1
339,I love it when Ben sleeps in because I get to watch all the programmes I want on Netflix without interruption !!!! happy,1
61, DM us happy  S,1
1236,talking to my over driver about where I'm goinghe said he'd love to go to New York too but since Trump it's probably not.1,0
921,mutual: let's talk more!me: for sure!mutual:  happy  me:.8,1
1790,What did he say I'm at work unhappy  totally made my day though,0
1950, 2010 Week 11,0
740,Thanks for being top engaged community members this week happy  Want this?,1
1720,it's only been a few days since their promotion ended but i'm already missing her so much unhappy  .2,0
555,aw BCC is having a PRIDE prom and i kind of want to go happy,1
806,Thanks for the recent follow Happy to connect happy  have a great Thursday..16,1
96,Ministers of PMLN are happy like those students who never studied for exams  luckily exams got delayed. They'll still ha,1
1960,Hi! We tried to call your number but got no response unhappy  Please share another suitable time and an alternate number.. cont1,0
1761,Someone build house on (4) i cant do it unhappy  cant believe this hasn't already been done????,0
183,SONE who cant stream at Genie!You CAN stream for TY at Genie! We are still sharing some Genie IDs. If you want it.1,1
596,thanks for the recent follow. Much appreciated happy  Get this,1
1273,Look like somethings i will ignore xD Kart Racing when? unhappy ,0
703,Thanks for the recent follow Happy to connect happy  have a great Thursday..11,1
1666,I need a car unhappy  but no car unhappy  poor me unhappy ,0
1927, Who hacked me unhappy ,0
1627,talking to my over driver about where I'm goinghe said he'd love to go to New York too but since Trump it's probably not.2,0
2275,I hate losing online friends unhappy  it's cruel when people deactivate unhappy  ,0
1316,- Thank you tons,0
976,Cheers :D,1
1908,they would have sustained their fame if they did unhappy ,0
442,Thanks for your feedback! It' just the starting phase,1
671,I'll keep you awake happy,1
1246,pamura isa because in this very moment,0
1444,i miss jihoon sad ,0
1386,Punishment time for JB's team! unhappy  ,0
1048, you don't ever have to thank me J hunt,1
1093, I released a new video about game genres.RTs are super appreciated happy,1
680,Hi Carlo! I'm okay nmn. Howdy? happy,1
914, yes it would have if it hadn't been for those meddling clouds smile,1
1981,this song will always be one of my faves unhappy  ,0
129,Here is a new thesis by another genius.Sir,1
551,Just over 91% in favour of the unelectable Jeremy Corbyn happy,1
833,Currently standing outside the shard with a bag full of empty bottles because I came to work with tom today happy,1
1743,this is damn.... theres people who sincerely want to attend BH birthday party but bcs of those people who try for fun make them ca.9,0
2003,WTF Canada 2017 and you are still in the 1700s. I Will Never support,0
967,Let me eat that cake! :D :P,1
1941,Same unhappy  I've unfollowed so many people ugh,0
1535,I should do aegyo because I lost unhappy  ,0
1522,i feel so sick today unhappy ,0
1524,its my birthday tomorrow baby unhappy ,0
268,kind of jealous with you all laughs but it's ny fault for not working hard happy,1
1580,The most painful goodbyes are the onesthat are never said and never explained crying  unhappy  :/,0
305,mutual: let's talk more!me: for sure!mutual:  happy  me:.2,1
276,Oh that feel when you have 10 gems :D,1
908, if anyone has got a design or could find me one I would be so grateful to you :D,1
1313,I face swapped a cat with a dog and it's really upsetting unhappy  ,0
964,instant message perfectly fine :D how about you fellow ken,1
692,there we go again smile,1
307,Tara,1
917,rt for 13 ffs-it's not much but they're free-legit-free but follow me first to get them quicker-be patient i will g.1,1
289,i welcome you to germany then. i have no authority to welcome you in the other countries though! happy,1
1071,i will do happy,1
1760,what's wrong with you why don't you like animals unhappy ,0
484,Do happy we are at 27 million keep it up happy  and we are at 71 million we are so close to have another 100m,1
956,your an inspiration to everyone Miss Jones happy,1
2285, instant message in a lot of pain and the school doesnt allow my to have my pain meds unhappy ,0
1730,Typed up all the medical  shorthand abbreviation we use for work,0
1244,Koalas are dying of thirst  and it's all because of us unhappy  ,0
1776,penge damit unhappy .1,0
312, DM us happy  S.2,1
977,thanks for the recent follow. Much appreciated happy  Want this.2,1
1801,Definitely my arms unhappy  .1,0
2183,Koalas are dying of thirst  and it's all because of us unhappy  .12,0
1129,YO THANK YOU FOR OVER 15,1
1055,Sir Ash Ketchum and Princess May. happy,1
210, new job starts in to  weeks! :D,1
376,mutual: let's talk more!me: for sure!mutual:  happy  me:.3,1
1401,last to  things i've bought from you no sweets unhappy ,0
67,uss,1
2103,this is jimin to yoongi unhappy  .5,0
1669,4/20 today,0
82,we finally got jinyoung to wipe it for jaebum himself but their precious son blocks it for the world to witness it,1
2167,this is damn.... theres people who sincerely want to attend BH birthday party but bcs of those people who try for fun make them ca.15,0
927,opera Nirjhor As long as they are not claiming to be the first one :D /Rosi,1
515,Nothing moves faster than a girl untagging herself from an ugly picture :)KISSES TheFashionIcon,1
1274,did ate jenna just blocked me or what? unhappy ,0
2071,Okey unhappy ,0
149,THIS RIGHT HERE.aren't you happy you don't have [x]???NO. BECAUSE I'M STILL HERE IN THIS 'CONDITION' WITH NO I,1
294,always running out of space on my phone,1
573,A Treaty could provide security/ tech for culture development happy,1
1694,my honey unhappy  .1,0
1122,i love him so much i want to kindly stroke his penis :D,1
817,Thanks for the recent follow Happy to connect happy  have a great Thursday. Get this,1
666,happy birthday nimesh!!! happy,1
1622,wowwow these are all so cute unhappy  i wantt ,0
1482,oh my god same! we should attend on some lessons together sometime just kidding HAHAH ,0
1901,Thats grim unhappy ,0
820,Thanks for the recent follow Happy to connect happy  have a great Thursday..18,1
1336,why are your campervan tickets so expensive? unhappy ,0
1830,help me too unhappy  as an early birthday gift huhu,0
2299,i miss so much unhappy ,0
465, the Mini and the Campervan happy,1
919, but Genix deserves so much more than Myth! Open your Eyes The Community want,1
1788, hyoug me longer than 10 secs. Hyoug me even when i don%27t want you to unhappy ,0
1407,ehh i cant DM you unhappy ,0
1011,Ministers of PMLN are happy like those students who never studied for exams  luckily exams got delayed. They'll still ha.2,1
409,Rose come to him! He's really your enthusiast :-D using SO MUCH not SO MAY!  :-)~~~,1
1565,I really enjoyed horrizion zero dawn but no idea what to play next unhappy ,0
1226,Shaandaar,0
1223,Yeah did update to 16.04 ,0
1874,this is jimin to yoongi unhappy  .3,0
1626,this is damn.... theres people who sincerely want to attend BH birthday party but bcs of those people who try for fun make them ca.6,0
697,Thanks for the recent follow Happy to connect happy  have a great Thursday. Want it.1,1
1457,Sad story unhappy  ,0
1158,Thanks for the recent follow Happy to connect happy  have a great Thursday. Get it.2,1
1413,I love got7 but god i am bored unhappy ,0
118,Thanks again for notifying us! We have updated our add-on plans accordingly happy,1
1353,Ohh welcome to CLXSSlC chanyeol oppa! Or should I call you with richard? Kalau jadi sayang gimana? unhappy ,0
2044,Last day of the camp tomorrow,0
120,A nice morning working from today. Lovely atmosphere,1
2178,I face swapped a cat with a dog and it's really upsetting unhappy  .4,0
370,Thanks for the recent follow Happy to connect happy  have a great Thursday..3,1
609,rt for 50 ffs-rt pinned tweet!!-be patient -legiiiiiiit-no saved accounts happy,1
772,lolo bin are you fucking mental screenshot :D HAHA,1
134,Its hard to see your best friend with another girl happy,1
643,Good morning every one.3,1
1134, have a great Thursday! Looking forward to reading your tweets happy   Want this,1
1150,Younger. Softer. crying with joy,1
1787,Jyoust hyoug me,0
2173,red velvet too unhappy  ,0
424,You know exactly what I'm talking about happy,1
1157,co,1
1041,I dedicate this song to,1
318,Thanks for the recent follow Happy to connect happy  have a great Thursday. Want this.1,1
688,to  pork pies happy,1
1635,True! Khilado kuch unhappy ,0
52,sounds like a lot of fun :D I like it,1
233,instant message fine yoo,1
1890,I want to give him everything that makes him happy just to see this smile unhappy ,0
214,mutual: let's talk more!me: for sure!mutual:  happy  me:.1,1
501, you'll be see.1,1
2, beauty and personality. :)KISSES TheFashionIcon,1
1828, sorry guys unhappy ,0
1056,this guy got me into exo back in 2013. he was also my very first bias in kpop. to be honest i miss him so much. happy birthd,1
1987,why did she delete the tweet,0
1968,i miss minmin crying ,0
1703,Why no available in the U.K.? unhappy ,0
1663,I face swapped a cat with a dog and it's really upsetting unhappy  .2,0
798,Thank you crew happy.3,1
786,AVI for my man :)Phone made like always wink,1
1994,we can get pork katsudon at Tokyo Diner! Tho it doesn't have egg in it unhappy ,0
2056,Koalas are dying of thirst  and it's all because of us unhappy  .9,0
1940,Don kray denial of normal bi say ,0
1189,I miss going to gigs in Liverpool unhappy ,0
1194,My area's not on the list unhappy  think I'll go LibDems anyway,0
1007,Hahaa I'm second best always happy,1
716, getting 70k,1
920,Hellooo.. happy  satans-daughter (taylynnox),1
1151,Happy many days,1
47,Gentle reminder on our TP guidelines happy  please read and spread. Thank you. happy KISSES TheFashionIcon,1
248,He's the best happy,1
851,We bought a 523 litre fridge. I am applying for cold storage license in Bhayander West :D,1
1549, and have fun ,0
1168,Thanks for the recent follow Happy to connect happy  have a great Thursday..32,1
190,Hey,1
1403,I don't want to tell fellow Comm students because i don't want them to think I'm some kind of suck-up... unhappy ,0
657,.Thanks so much for the RT,1
209,I hit that,1
203,I think I'm probably beyond repair by the sounds of tea etiquette happy,1
7,happy anniv ming and papi!!!!! love love happy,1
604,Thank you so much sir happy  please watch the film and call me happy,1
607,they are real subs and here's the link for the video happy,1
880,And that's what's important! happy  that's what I'm trying to remember.,1
1118,Superstar thanks so much for the kind words! Look forward to seeing you soon buddy smile.4,1
509,I love my six pack so much,1
1354,we don%27t talk anymore like we used to do unhappy .1,0
725, you can get a professional one here,1
1255, oh no unhappy  Could you please tell me a little more about your issue? Im following if youd prefer to DM. Amanda,0
473,Thank you so much my friend smile  xx,1
1476,I can't access my school emails from any web browser unhappy  Yet I have so much homework for all my subjects on there,0
199,Spending my night talking to my beloved ???Perfect.I LOVE YOU MAN! happy,1
2297,YG should have sent them to MCD. I want to see them holding the trophy unhappy  anyways .10,0
445,mutual: let's talk more!me: for sure!mutual:  happy  me:.4,1
1191,it's that A*dy guy from pop Asia and then the translator so they'll probs go with them around Aus unhappy ,0
272,LADIES!  - tell me why yoyoyou don't play golf. What wyoyoyoud make yoyoyou want to play? Top 3 reasons yoyoyou DO play? heyjyoyoyoude66info,1
830, this is the main reason I drink Total selflessness :D,1
441,how do we book the cars service for the swards tommorow :D,1
749,Seokjinie went to Everland today~ I guess he forgot that he's an idol.1,1
1608,0 motivation to study unhappy  ,0
758,So Happy It's Thursday*,1
634,You say VUCA,1
1548,i love youu so much unhappy  thank you,0
2005,suuuuuuuuss scared crying ,0
1534,this is damn.... theres people who sincerely want to attend BH birthday party but bcs of those people who try for fun make them ca,0
577, delivering the Conservative message of strong  stable leadership. happy,1
535,Have I told you lately that olive juice? :D,1
739,Thanks for the recent follow Happy to connect happy  have a great Thursday..14,1
799,Thanks for the recent follow Happy to connect happy  have a great Thursday. Want it.2,1
600,because you are one happy,1
34,thanks for being top new followers - have a great week happy,1
1665,I miss my boo so much unhappy ,0
2256,shouldn't keep Kenyans complaining on ,0
1270,i want to make waffles unhappy ,0
567,no pressure happy,1
1664,failed unhappy  .g hehe,0
2217,ohh normally I feel sick when I drink like 3-4 cups of coffee ,0
269,Appreciate your recent retweets Have a great Thursday happy,1
1460,Looks awesome Annette,0
470,I considered asking where that came from. :D,1
1409,why is italian easier than spanish unhappy ,0
1798,I ordered car yesterday,0
452, can list them if you want happy,1
1722,Call center nice game 4/20 unhappy ,0
1379,Nice! Some really nice stuff there! Mostly black dresses which i won't get away with for a June wedding though unhappy ,0
960,AVI for my man :)Phone made like always wink.1,1
1794,i miss you too unhappy ,0
1089,Thanks for the recent follow Happy to connect happy  have a great Thursday. Want this.6,1
1009,Superstar thanks so much for the kind words! Look forward to seeing you soon buddy smile.3,1
23,Happy 420 happy  pass it to your followers!,1
1860,Been streaminuteg for 45 minute not understanding a thing and still.. unhappy ,0
1740,this is damn.... theres people who sincerely want to attend BH birthday party but bcs of those people who try for fun make them ca.8,0
748,Share the love: thanks for being top new followers this week happy  Want it,1
1412,i want to cry unhappy ,0
1202,Becoz if we will depend on your promoting its waste of hardwork to all team who ,0
1091,I say keep with it. happy,1
1591,this is damn.... theres people who sincerely want to attend BH birthday party but bcs of those people who try for fun make them ca.5,0
1479, that fall was a mess unhappy ,0
1757,  i was going to add bazza,0
1792,I DON'T KNOW WHERE I WAS AT THIS TIME BUT I HAVE RETWEETED NOW AND I'VE BEEN WAITING THE DM FOR A LONG TIME unhappy ,0
947,i took a full drink into my uber; i guess you could say instant message pretty wild. These are the Tuesdays we'll never forget happy,1
1748,poor baby unhappy  I hate people .1,0
1279,I want a puppy now unhappy ,0
1690,She loved Beth so much unhappy ,0
325,okay happy,1
585, I guess it's a good thing then to bring it right to the foreground and put it right in their face,1
778,This was awesome--  has two fill-ins this week happy,1
2023,Who got to pen today man crying ,0
2048,now i don%27t want to go camp unhappy ,0
724,Hey.1,1
812,Ruby was rehomed for times before she was for months old  now loves her forever home. Pls always consider rescue when,1
1043,stay cool ,1
267,As in most used. Stats don't care about motivation happy,1
713, our lovely lunch menu is sure to please! smile,1
416,Awesome recommendation Jess! Listened to the,1
1923,Trying to get in touch with but their numbers appear to be down! unhappy ,0
864,Share the love:thanks for being top new followers this week happy   Want this,1
489,Stats for the week have arrived. 1 new follower and NO unfollowers happy  via,1
2080,So I may be one of those workers who are not properly compensated unhappy ,0
856,good luck! You have my vote smile,1
218, owner told me about it (as in article) smile,1
2100,He's not beating the two favourites here anyway so I'll stop caring about this match,0
2127,ikr!! unhappy  oki welcome sam ,0
1293,give me a chance in west server unhappy ,0
652, let me know!  :-)(I'M A CHAMPION!!!!!)Elder Lenore A. ArtisMinistries...,1
1718,Cram reading unhappy ,0
2126, basketball etc theyre all restrict.Threw ,0
1526,Super unhappy ,0
979,Hey thanks for being top High Value Members of last week,1
1979,this is damn.... theres people who sincerely want to attend BH birthday party but bcs of those people who try for fun make them ca.13,0
99,Miss Petite happy Thursday happy   looking forward to the weekend?,1
672,Hello everyone,1
30,Never known how hard it is until last to  days how to resist temptation to enter politics debates on social media happy  stood firm so far,1
1031,Thats sooooooooooooo sick!!!! xD Thanks so much for making it Kin!! I love it! :D,1
1090,thanks for the recent follow. Much appreciated happy   Want this ?.3,1
24,Who wants some good vibes? Watch this on YouTube or TV100 application now for FREE happy,1
